{
  "schema_version": "cavra.aispm.agent_blast_radius.v1",
  "product": "CAVRA",
  "edition": "community",
  "mode": "local_activity",
  "data_provenance": "sample_data",
  "tracking": "none",
  "telemetry": "disabled",
  "generated_at": "2026-06-10T02:33:59.191403+00:00",
  "filters": {
    "repository": null,
    "agent_id": null,
    "policy_pack": null,
    "limit": 200
  },
  "summary": {
    "total_agents": 2,
    "critical_agents": 0,
    "high_agents": 1,
    "medium_agents": 0,
    "low_agents": 1,
    "affected_repositories": 2,
    "approval_paths": 1,
    "evidence_confidence": "activity_evidence_refs"
  },
  "items": [
    {
      "agent_id": "codex-agent",
      "blast_radius_level": "high",
      "blast_radius_score": 71,
      "repository_count": 1,
      "repositories": [
        "payments/api"
      ],
      "control_surfaces": [
        "infrastructure_iac",
        "sensitive_data"
      ],
      "policy_packs": [
        "cavra-ai-agent-baseline",
        "cloud-iam-prod"
      ],
      "tool_labels": [
        "filesystem",
        "shell"
      ],
      "target_classes": [
        "production_infrastructure",
        "sensitive_data:redacted"
      ],
      "sensitive_target_count": 1,
      "production_infrastructure_count": 1,
      "approval_paths": [
        "approval_required_unassigned"
      ],
      "decision_count": 2,
      "session_count": 1,
      "blocked_actions": 1,
      "approval_required_actions": 1,
      "warned_actions": 0,
      "top_risks": [
        "sensitive_data_reach",
        "production_infrastructure_reach",
        "blocked_action_history",
        "approval_gated_actions"
      ],
      "recommended_controls": [
        "capture_signed_evidence",
        "review_agent_scope",
        "keep_block_enforcement_enabled",
        "bind_explicit_approval_route",
        "redact_sensitive_targets",
        "require_blast_radius_context"
      ],
      "evidence_refs": [
        "sample://evidence/iac-production-change",
        "sample://evidence/secret-read-block"
      ],
      "last_seen_at": "2026-06-09T00:01:30+00:00"
    },
    {
      "agent_id": "claude-code-agent",
      "blast_radius_level": "low",
      "blast_radius_score": 10,
      "repository_count": 1,
      "repositories": [
        "platform/infra"
      ],
      "control_surfaces": [
        "mcp_tools"
      ],
      "policy_packs": [
        "mcp-enterprise"
      ],
      "tool_labels": [
        "filesystem.write"
      ],
      "target_classes": [
        "tooling_surface"
      ],
      "sensitive_target_count": 0,
      "production_infrastructure_count": 0,
      "approval_paths": [],
      "decision_count": 1,
      "session_count": 1,
      "blocked_actions": 0,
      "approval_required_actions": 0,
      "warned_actions": 1,
      "top_risks": [
        "tooling_surface_reach"
      ],
      "recommended_controls": [
        "capture_signed_evidence",
        "review_agent_scope",
        "bind_explicit_approval_route",
        "verify_tool_trust_tier"
      ],
      "evidence_refs": [
        "sample://evidence/mcp-warning"
      ],
      "last_seen_at": "2026-06-09T00:02:30+00:00"
    }
  ],
  "redaction": {
    "private_asset_graph": "requires_cavra_enterprise",
    "identity_permission_graph": "requires_cavra_enterprise",
    "cloud_account_inventory": "requires_cavra_enterprise",
    "dependency_graph": "requires_cavra_enterprise",
    "secret_names": "requires_cavra_enterprise",
    "customer_topology": "requires_cavra_enterprise"
  },
  "enterprise_unlocks": {
    "status": "requires_cavra_enterprise",
    "capabilities": [
      "identity and permission-aware blast-radius analysis",
      "cloud account, Kubernetes, SaaS, and repository dependency graphing",
      "private asset criticality and owner enrichment",
      "secret and data classification mapping without public disclosure",
      "live blast-radius alerts and executive risk narrative export"
    ],
    "private_package": "cavra_enterprise"
  }
}
